通用名,商品名称,规格,箱规,国药准字,厂家,供应商,是否有活动
 云南白药牙膏(薄荷清爽型)    210g, ,210g,48  盒  ,Q/YBY30 ,云南白药集团股份有限公司 ,成都拜欧药业股份有限公司,有
华素愈创优效修复漱口水（海洋薄荷香型）华素制药 华素愈创优效修复漱口水（海洋薄荷香型）    260ml.,华素愈创优效修复漱口水（海洋薄荷香型）华素制药 ,260ml.,36  盒  ,粤卫消证字（2011）第8015号 ,广州市花都区晶神保健品厂 ,成都拜欧药业股份有限公司,有
 潜龙口洁抑菌粉    1g, ,1g,1  盒  ,黔卫消证字[2008]第0029号 ,贵州潜龙生物科技有限公司 ,重庆赛力君安医药有限公司,有
 云南白药牙膏    165g, ,165g,54  盒  ,XK16-108-7507 ,云南白药集团股份有限公司 ,岳阳康尔医药有限公司,无
亲亲小象-儿童健齿牙膏牙刷套装 亲亲小象-儿童健齿牙膏牙刷套装    （50g+1支）,亲亲小象-儿童健齿牙膏牙刷套装 ,（50g+1支）,10  盒  ,粤妆2010400 ,汕头市李施德林化妆品有限公司 ,中山达亿康商贸有限公司,无
 云南白药牙膏(薄荷清爽型)    210g, ,210g,48  盒  ,Q/YBY30 ,云南白药集团股份有限公司 ,四川仁通医药有限公司,无
渠道 云南白药牙膏    165g, ,165g,54  盒  ,XK16-108-7507 ,云南白药集团股份有限公司 ,广东扬帆药业有限公司,无
 口腔溃疡喷剂    20ml, ,20ml,400  盒  ,陕卫消证字（2012）第0155号 ,西安利君药业有限公司 ,广东扬帆药业有限公司,无
