通用名,商品名称,规格,箱规,国药准字,厂家,供应商,是否有活动
 B族维生素片    0.5g*60片 / 盒, ,0.5g*60片 / 盒,200  盒  , ,山东圣海保健品有限公司 ,湖北巨世医药有限公司,有
 B族维生素片    0.5g*100片 / 盒, ,0.5g*100片 / 盒,200  盒  , ,山东圣海保健品有限公司 ,湖北巨世医药有限公司,有
新盖中盖 新盖中盖牌儿童钙片    1.75g/片*60片,新盖中盖 ,1.75g/片*60片,60  盒  ,卫食健字(2002)第0162号 ,哈药集团制药六厂 ,广东壹号药业有限公司,无
蛋白质粉 蛋白质粉    900g.,蛋白质粉 ,900g.,1  盒  ,QS3600 0601 0592 ,江西樟都药业有限公司 ,成都拜欧药业股份有限公司,有
西洋参含片 西洋参含片    1250mg*12片.,西洋参含片 ,1250mg*12片.,360  盒  ,国食健字G20060793 ,福建斯特龙生物药业有限公司 ,成都拜欧药业股份有限公司,有
五维赖氨酸颗粒 五维赖氨酸颗粒    5g*12袋.,五维赖氨酸颗粒 ,5g*12袋.,120  盒  ,H22024346 ,延边大学草仙药业有限公司 ,成都拜欧药业股份有限公司,有
维生素AD滴剂/伊可新（1岁以上） 维生素AD滴剂/伊可新（1岁以上）    2000单位*30粒,维生素AD滴剂/伊可新（1岁以上） ,2000单位*30粒,180  盒  ,国药准字H37022974 ,山东达因海洋生物制药股份有限公司 ,黑龙江省华源医药股份有限公司,有
